{
  "schema": "sv-llm.sandbox-work/v0.1",
  "work_id": "fixture-work-001",
  "manifested_request": {
    "manifest_id": "fixture-manifest-001",
    "request": "Review the candidate contract for contradictions."
  },
  "parent_transition": {
    "transition_class": "ORGANIZATION_INGRESS_MATERIALIZED",
    "repo_receipt_sha256": "sha256:0000000000000000000000000000000000000000000000000000000000000000",
    "org_receipt_sha256": "sha256:0000000000000000000000000000000000000000000000000000000000000000",
    "subject_or_artifact_digest": "sha256:0000000000000000000000000000000000000000000000000000000000000000"
  },
  "canonical_context_refs": [
    {
      "view_id": "fixture-view-001",
      "intr_receipt_id": "fixture-intr-receipt-001"
    }
  ],
  "requested_capabilities": [
    "adversarial_review",
    "synthesis"
  ],
  "permitted_capabilities": [
    "adversarial_review",
    "synthesis"
  ],
  "participation_policy": {
    "mode": "CHALLENGER"
  },
  "expected_output_or_handoff": {
    "successor_transition_class": "SANDBOX_SYNTHESIS_RECORDED"
  }
}
